[
	{
		"testingName": "Your Name 1",
		"testingReferenceIdentifier": ["id1", "id2"],
		"testingReferenceIdentifierType": ["GRID", "ROR"],
		"awardNumber": ["Award1", "Award2"],
		"NIH": "No",
		"awardTitle": ["This is my title 1", "second title"]
	},
	{
		"testingName": "Your Name 2",
		"testingReferenceIdentifier": ["id1"],
		"testingReferenceIdentifierType": ["ROR"],
		"awardNumber": ["Award2"],
		"NIH": "No",
		"awardTitle": ["This is my title 2"]
	},
	{
		"NIH": "Yes",
		"testingName": "Your Name 3",
		"testingReferenceIdentifier": ["id1", "id2"],
		"testingReferenceIdentifierType": ["GRID", "ROR"],
		"awardNumber": ["Award1", "Award2"],
		"awardTitle": ["This is my title 3", "another title"]
	}
]
